{
  "case_id": "medseg_slice_032",
  "seed": 2026,
  "method": "supervised",
  "evaluation_unit": "image_level_selected_slice",
  "provenance": {
    "source_image_sha256": "f292b8fdbbbc83332748ca351fa281ae14bfbd711d6a17a3f2ee9803d38e7c6a",
    "prediction_file": "artifacts/large/notebook09_corrected/seed_2026/supervised/medseg_slice_032.npz",
    "prediction_sha256": "e3819f941bbfe6946152ee3a0df702592e5e1ddb0937d29e9fc7696c031d6baf",
    "checkpoint_sha256": "24afba620d7569d980f963ec53cc7dcbb82474aeaa8057972722786a71a8caa6",
    "frozen_protocol_sha256": "bbc6a43fcb3627ca1dc3f703c205fc29a394815dd32ffd914c6b9e176b15acc1",
    "preprocessing": "clip_-1250_250_scale_0_1"
  },
  "geometry": {
    "original_shape": [
      512,
      512
    ],
    "complete_volume": false,
    "spacing_status": "unverified",
    "orientation_status": "insufficient_for_laterality",
    "measurement_units": "pixels"
  },
  "target_lesion_evidence": {
    "single_view_lesion_pixels": 3904,
    "single_view_target_opacity_detected": true,
    "four_view_lesion_pixels": 3128,
    "stability_range_pixels": null
  },
  "uncertainty": {
    "case_uncertainty_score": 0.5500227808952332,
    "source_p80_gate": 0.4250306069850922,
    "passes_default_gate": false
  },
  "eligibility": {
    "lesion_extent_pixels": false,
    "physical_area": false,
    "whole_volume": false,
    "lung_burden": false,
    "laterality": false,
    "lobar_location": false
  },
  "unsupported_fields": {
    "lesion_area_mm2": "Unavailable because physical pixel spacing is not verified for the locked MedSeg image.",
    "lesion_volume_mm3": "Unavailable because the input is a selected 2D image, not a verified complete CT volume.",
    "lesion_volume_cm3": "Unavailable because complete-volume voxel geometry is not available.",
    "whole_lung_involvement_percent": "Unavailable because a deployable lung-mask denominator is not available in the core evaluation.",
    "patient_level_burden": "Unavailable because verified MedSeg patient grouping is not available.",
    "laterality": "Unavailable because verified orientation and lung separation required for laterality are not established.",
    "lobar_location": "Unavailable because lobar anatomy is not inferred from a 2D image midpoint."
  },
  "limitations": [
    "Evidence is derived from a selected 2D MedSeg image and must not be interpreted as a complete-volume measurement.",
    "Physical lesion area and volume are unavailable because verified physical geometry is not established.",
    "Whole-lung involvement is unavailable because a deployable lung denominator is not available.",
    "Laterality and lobar localization are not emitted.",
    "An empty predicted lesion mask means only that no target opacity was detected by the model; it does not establish a normal scan or absence of disease."
  ]
}
